src|alt|url|freezeframe
yukiki.png|A stamp with an image of Yukiki from the Keroro Gunso/Sgt. Frog anime series;https://deviantart.com/view/107318230;||
yourownsite.png|A stamp based on a Windows interface with text that reads, "Maybe you should make your own website"|http://lu.tiny-universes.net/index2.html;|
you-are-valid.gif|An animated stamp with text that reads, "If you are trans and you can't/don't take hormones, get surgery, you are valid!"|https://deviantart.com/view/660085138|true
yeet.png|A pastel pink stamp with text that reads in all capital letters, "Yeet"|https://deviantart.com/view/803089155;|
windows-updater.gif|An animated stamp that switches through several versions of Windows interfaces. The main text in some message boxes reads, "Upgrade" and a mouse curse clicking on "OK" until eventually the text reads, "Wait, stop...", "No go back", and "Help" until a blue screen of death appears|https://zeusofthecrows.tumblr.com/post/695197705533865984|true
washyourhands.gif|An animated pastel pink stamp with text that reads, "Wash your hands" and an image of hands underneath a stream of water|https://deviantart.com/view/808921729|true
venus-flytrap.png|A stamp of a pot of venus fly trap plants with a blue and purple filter|https://deviantart.com/view/629663832;|
vaccines.gif|A pastel pink stamp with text that reads, "Vaccines are for our own good and an image of a syringe with pink medicine"|https://deviantart.com/view/809511567|true
trigun_fan.gif|An animated stamp based on the '98 version of Trigun that switches between the logo and a few scenes. One scene has Vash the Stampede removing empty bullets from his custom revolver, and another scene is a stationary image of Vash|https://deviantart.com/view/199256512|true
triggered-jokes.png|A purple stamp with the appearance of a classic Windows user interface. The text reads in capital letters, "Triggered jokes will never be funny"|https://deviantart.com/view/709698048;|
treasure_planet.png|A pastel stamp with a lacy border based on Disney's Treasure Planet. The cursive text reads, "Treasure Planet". The bottom left corner has the initials "TP" and the bottom right corner has an image of a planet|https://deviantart.com/view/370657016;|
thinger-strangs.gif|An animated stamp based on the Netflix series, "Stranger Things". The stamp is animated like the intro, but instead of the letters forming "Stranger Things" they form "Thinger Strangs"|https://zeusofthecrows.tumblr.com/post/702193331527122944|true
spherical.png|A stamp of a scene from Drake & Josh. The text reads, "It's spherical"|https://deviantart.com/view/636000130;|
souleater.gif|An animated stamp of Maka Albarn and Soul Evans from Soul Eater|https://devstamps.tumblr.com/post/175558482725|true
snowing.gif|An animated stamp of a snowy landscape|https://deviantart.com/view/689276975|true
sitonyou.png|A stamp of a man from Tim and Eric's Awesome Show. The text reads in all capital letters, "This is what I do I sit on you"|https://deviantart.com/view/661844128|true
serenity-loz.gif|A black stamp with an image of the Triforce from the Legend of Zelda series and text reads, "Lord, give me the courage to change what I can in life, the power to endure what I cannot change, and the wisdom to know the difference"|https://deviantart.com/view/349642137|true
robbie-rotten.gif|An animated stamp of Robbie Rotten from Lazytown from a scene from the musical number, "We are Number One"|https://deviantart.com/view/165305542|true
rent.gif|A pastel pink stamp with pink-bordered white text that reads "Don't make your kids pay rent."|https://deviantart.com/view/811647751|true
rengoku.png|A stamp of Kyojuro Rengoku from Demon Slayer facing the camera. There are various pixel sparkles and hearts around him.|https://deviantart.com/view/819015233;|
rayman.png|A stamp with an image of Rayman and the Rayman logo. In the background is a darkened image of how Rayman appears in Rayman 1.|https://deviantart.com/view/622184361;|
protectlgbtkids.png|A pastel rainbow stamp with pink-bordered white text that reads, "Protect LGBTQIA+ kids"|https://deviantart.com/view/512937557;|
progress.png|A blue and pink gradient stamp with white text that reads in capital letters, "Little progress is better than no progress"|https://deviantart.com/view/534244065;|
prochoice.gif|A blue and purple gradient stamp with a lacy white border and wiggly white text that reads, "Pro-choice"|https://deviantart.com/view/578444226|true
ppte.png|A stamp of Popuko and Pipimi from Pop Team Epic|https://deviantart.com/view/725532515;|
pleasing-everyone.gif|A pink stamp with text that alternates between "There is no key to success" and "But the key to failure is trying to please everyone"|https://deviantart.com/view/356408020|true
pink_jjba.png|A pink stamp with a lacy border and the Japanese logo for JoJo's Bizarre Adventure|https://deviantart.com/view/691729258;|
pbj.png|A pink stamp with an image of a smiling banana with limbs and white text that reads, "It's peanut butter jelly time!" based on an old meme from the early 2000s|https://deviantart.com/view/80263819;|
oktocry.gif|A pastel purple stamp with text that reads, "It's ok to cry"|https://deviantart.com/view/690666751|true
no-thoughts.png|A pastel stamp with an image of My Melody and text that reads, "No thoughts, head empty"|https://deviantart.com/view/838936634;|
morethanyourmistakes.png|A pink stamp with white text that reads "You are more than your mistakes"|https://deviantart.com/view/594119088;|
metal-sonic.png|A pastel stamp with an image of Metal Sonic from the Sonic the Hedgehog franchis with pink-bordered white text that reads in all capital letters, "Metal Sonic"|https://deviantart.com/view/788066917;|
meowth.png|A pink stamp with a sprite of Meowth and text that reads "Shut your Meowth!" which is a play on words based on "Shut your mouth!"|https://deviantart.com/view/168989329;|
mencry.png|A black and purple stamp with pink text that reads, "Saying men should not cry is SEXIST"|https://deviantart.com/view/623737033;|
medievil.gif|A stamp of the cover of the PS1 MediEvil game with the yellow text that reads in all capital letters "MediEvil", with Sir Daniel Fortesque seen at the bottom of the stamp|https://deviantart.com/view/169065888;|
mary-sue.png|A pastel purple and white stamp with purple text that reads, "Mary Sue SAFE ZONE"|https://deviantart.com/view/412393351;|
mah_boi.gif|A stamp with a red background and a pixel art of the King of Hyrule from the Zelda CD-i games. The text reads "MAH BOI!" which is a corruption of "My boy!"|https://deviantart.com/view/465275243;|
made_in_the_90s.gif|A pink purple stamp with white glowing text that reads "Made in the 90's"|https://deviantart.com/view/82151512|true
luckycharms.gif|A animated stamp with alternating images of the Lucky Charms marshmallows and flashing text that reads, "Lucky Charms"|https://deviantart.com/view/212859832|true
lovecereal.gif|A pink stamp with a blue bowl with cereal and milk. The text reads "I love cereal". The letter "o" in "love" is replaced by a pixel heart|https://deviantart.com/view/476084744|true
lovewhenppldrawmyOCs.png|A pink striped stamp with text that reads, "I love when people draw my characters". The word "love" is replaced with a red heart|https://deviantart.com/view/438561366;|
life_is_ok.png|A pink stamp that resembles a Windows 97 window. The text reads "Life is:" followed by a button that reads "OK"|https://deviantart.com/view/714919530;|
linebeckfan.gif|A stamp of Captain Linebeck from "The Legend of Zelda: Phantom Hourglass". The text reads "Linebeck Fan"|https://deviantart.com/view/73233111;|
lgbtnohate.png|A magenta stamp with various sparkles and text that reads, "LGBT person who DOES NOT hate cis/straight people"|https://deviantart.com/view/890680450;|
kittycry.png|A stamp with some sparkles, hearts, and an image of a crying cat with a pastel pink overlay|https://deviantart.com/view/800243123;|
kururu.png|A stamp with a yellow checked background, the Keroro Gunso logo, and an image of Sgt. Major Kururu|https://deviantart.com/view/194172443;|
kindnesschangeslives.png|A stamp with a pink and purple gradient, and text that reads, "Kindness changes lives"|https://deviantart.com/view/514294834;|
kerorogunso.gif|An animated stamp with the Sgt. Frog logo and a scene from the opening of the Keroro Platoon marching in front of a waving flag|https://deviantart.com/view/278336704|true
kazoo-kid.gif|A animated stamp of a boy enthusiastically playing the kazoo|https://deviantart.com/view/630649581|true
justkeep.gif|A pink stamp with text that reads, "Just keep" and text that reads, "learning", "moving", "growing", "believing", "trying", and "going"|https://deviantart.com/view/565360260|true
jonathan.gif|An animated stamp of Jonathan Joestar from "JoJo's Bizarre Adventure". Erina (who is offscreen) is cupping Jonathan's cheek with her hand, and he reacts by embracing the touch|https://deviantart.com/view/750554707|true
itisamystery.gif|A pink and black gradient stamp with a pixel ghost and text that reads, "it is a mystery"|https://deviantart.com/view/105072640;|
intj.gif|An animated stamp with a lacy border, an image of a castle with a pink and purple overlay, text that reads "INTJ" and text that alternates between "introverted", "intuitive", "thinking", and "judging"|https://deviantart.com/view/630943052|true
inspiration.png|A pink stamp with white text that reads in capital letters, "The biggest favour you can do for yourself is to turn envy into inspiration"|https://deviantart.com/view/252588127;|
inactive.png|A pink stamp that reads in capital letters, "Sometimes I'm just INACTIVE"|https://deviantart.com/view/361174494;|
i-am-strong.png|A pink stamp with white text that reads in capital letters, "I am strong, I can do this"|https://deviantart.com/view/710667148;|
hnk.png|A stamp of Bort, Phosphophyllite, and Diamond from the series, "Houseki no Kuni" or "Land of the Lustrous"|https://deviantart.com/view/721919318;|
hard-on-yourself.png|A pink stamp with white text that reads in capital letters, "Don't be so hard on yourself"|https://deviantart.com/view/803720180;|
gmd.gif|A animated stamp of a scene from Disney's "The Great Mouse Detective"|https://deviantart.com/view/382639660|true
giovanni.gif|A animated stamp with a beige background, an image of Giovanni as he appears in Pokémon HeartGold and SoulSilver, and the Earth badge spinning|https://deviantart.com/view/156521526|true
gamecube.png|A stamp with a black background and an image of the Nintendo Gamecube logo|https://deviantart.com/view/685836227;|
fruits.png|A stamp of several berry fruits, including blueberries, raspberries, and strawberries. There is text at the bottom left that reads "Love fruits". The word "love" is replaced by a heart|https://deviantart.com/view/389632601;|
emolga.png|A stamp of the Pokemon Emolga winking towards the camera|https://deviantart.com/view/205886503;|
dvd_logo.gif|A animated stamp of a television and a DVD logo with alternating colors and bouncing around the screen|https://zeusofthecrows.tumblr.com/post/702193331527122944/assorted-stamps|true
donuts.gif|A animated stamp with a blue striped background, wiggling pixel donuts, and text that reads in capital letters, "I love donuts". The word "love" is replaced by a pixel heart|https://deviantart.com/view/366391499|true
dontforgettoeat.gif|An animated pink-striped stamp with text that reads, "Don't forget to eat!!" The word "eat" is wiggling slightly|https://deviantart.com/view/152544210|true
donchan.gif|An animated stamp of Don-chan from the Taiko no Tatsujin series dancing with a pink and blue background|https://deviantart.com/view/152544210|true
destroy-cringe-culture.png|A striped pink stamp with several sparkles and text that reads in capital letters, "Destroy cringe culture"|https://deviantart.com/view/693185742;|
deadbeats.gif|An animated stamp of a scene from the "Ghost" music video with three Deadbeats singing|https://deviantart.com/view/492564730|true
claude.gif|An stamp of Claude Faustus from Black Butler Season 2 adjusting his glasses|https://deviantart.com/view/507228125|true
caddicarus.gif|A black and purple gradient stamp with the Caddicarus logo and an image of Caddicarus. There are also two small explosions on the stamp|https://aloftmelevar.com/mels-place/webgraphics|true
askforhelp.png|A mint stamp with a ribbon border and text that says "It's ok to ask for help"|https://deviantart.com/view/589351278;|
art.gif|A pink stamp with text that says in capital letters "Art makes me", the text below it cycles through "happy, excited, confident, unique".|https://deviantart.com/view/321315631|true
antismoke.gif|A pastel pink stamp with a faint white grid background, an animated image of a cigarette with a red "X" over it, and text that reads, "Keep your smoke away from us"|https://deviantart.com/view/807028106|true
anti-ai-941484651.png|A black anti-AI stamp with text that reads, "AI" and is also crossed out in red|https://deviantart.com/view/941484651;|
animalcrossing.gif|An animated pastel pink stamp with a spinning image of the iconic furniture leaf from the Animal Crossing series. The text reads, "I love Animal Crossing!"|https://utsushimi.neocities.org/grfx|true
adhd_awareness.png|A purple stamp with a dark purple ribbon on the side and text that reads in all capital letters, "ADHD Awareness"|https://deviantart.com/view/801861400;|
rainbow-big.png|A liquid-like rainbow stamp with a lacy border and several hearts|https://deviantart.com/view/747480387;|
poogie-love-big.gif|An animated stamp of a scene from Monster Hunter of a hunter petting a Poogie wearing a watermelon suit|https://deviantart.com/view/524774833|true
pink-water-big.gif|An animated stamp with several heart decorations and an image of a pink ocean|https://deviantart.com/view/746751581|true
petty_drama.gif|A pink stamp with a rainbow border, white sparkles, and wiggling rainbow text that reads, "Petty drama is funny"|https://deviantart.com/view/720107983|true
mental-health-big.png|A pastel blue stamp with white text that reads "Mental health is just as important as physical health"|https://deviantart.com/view/702076049;|
glad-i-met-you-big.png|A white stamp with a pink border, ribbons on the corners of the stamps, and pink text that reads in all capital letters, "I'm glad that I met you"|https://deviantart.com/view/763965977;|
donuts-big.png|A large stamp with a pink background and several donuts|https://deviantart.com/view/746747750;|
crona-big.gif|An animated stamp with a purple border, moon-shaped pixels in the corners, and a scene of Crona from Soul Eater hugging a pillow|https://deviantart.com/view/862087955|true
cherry-blossoms-big-746088159.gif|A large animated stamp of cherry blossoms fluttering in the wind|https://deviantart.com/view/746088159|true
black_cats-big-155258054.gif|A large black stamp with two black cats on opposite sides of the stamp and text that reads, "I love black cats". The word "love" is replaced by a blinking and flashing red heart|https://deviantart.com/view/155258054|true
